{
  "benchmarkVersion": "contextforge-benchmark-v1",
  "datasetVersion": "contextforge-dataset-v1",
  "repositories": [
    {
      "repositoryId": "contextforge-phase5",
      "kind": "PINNED_GIT",
      "repositoryRevision": "77944250fe022794cb4b86b96415c8fac625f632"
    },
    {
      "repositoryId": "curated-typescript-v1",
      "kind": "CURATED_FIXTURE",
      "repositoryRevision": "sha256:4b2163c07e4a55d230f55a38c7da4e7f148046c8185a72c1b7718fcd6d6d14cc",
      "relativePath": "benchmarks/corpus/typescript"
    },
    {
      "repositoryId": "curated-python-v1",
      "kind": "CURATED_FIXTURE",
      "repositoryRevision": "sha256:1894ba29665a65eb3692e13d9fc8115a806c4641d9b6fb5b2abe0b749544e2ad"
      ,"relativePath": "benchmarks/corpus/python"
    },
    {
      "repositoryId": "curated-mixed-v1",
      "kind": "CURATED_FIXTURE",
      "repositoryRevision": "sha256:987ae64795f93a9b37be0f838052979e89287d2268822c18d235397b263c93f3",
      "relativePath": "benchmarks/corpus/mixed"
    }
  ],
  "tasks": [
    {
      "taskId": "self-pack-exact",
      "repositoryId": "contextforge-phase5",
      "repositoryRevision": "77944250fe022794cb4b86b96415c8fac625f632",
      "taskText": "Review buildContextPack before changing its final hard-budget verification.",
      "taskCategory": "EXACT_SYMBOL",
      "languageTags": ["typescript"],
      "difficulty": "EASY",
      "goldFiles": [
        { "path": "src/application/build-context-pack.ts", "importance": "REQUIRED", "rationale": "Owns production packing and final budget verification." },
        { "path": "src/core/context-pack.ts", "importance": "SUPPORTING", "rationale": "Defines the manifest and selected-range contract returned by the use case." }
      ],
      "goldSymbols": [
        { "path": "src/application/build-context-pack.ts", "qualifiedName": "buildContextPack", "importance": "REQUIRED", "rationale": "The requested implementation entry point." },
        { "path": "src/core/context-pack.ts", "qualifiedName": "ContextPackManifest", "importance": "SUPPORTING", "rationale": "The stable output contract affected by packing changes." }
      ],
      "goldRanges": [],
      "notes": "Explicit identity case retained as an EASY control, not representative of natural-language retrieval."
    },
    {
      "taskId": "self-index-activation-race",
      "repositoryId": "contextforge-phase5",
      "repositoryRevision": "77944250fe022794cb4b86b96415c8fac625f632",
      "taskText": "Fix the race that could expose a half-written active generation when two index writers overlap.",
      "taskCategory": "CONCURRENCY",
      "languageTags": ["typescript"],
      "difficulty": "HARD",
      "goldFiles": [
        { "path": "src/adapters/sqlite/sqlite-index-repository.ts", "importance": "REQUIRED", "rationale": "Owns BEGIN IMMEDIATE, validation, activation, commit, and writer failure behavior." },
        { "path": "src/application/build-index.ts", "importance": "REQUIRED", "rationale": "Runs scan, parse, graph build, and generation construction inside the repository transaction callback." },
        { "path": "test/integration/sqlite-index.test.ts", "importance": "SUPPORTING", "rationale": "Contains active-generation and writer-lock regression coverage." }
      ],
      "goldSymbols": [
        { "path": "src/adapters/sqlite/sqlite-index-repository.ts", "qualifiedName": "SqliteIndexRepository.buildAndActivate", "importance": "REQUIRED", "rationale": "The atomic publication boundary." },
        { "path": "src/application/build-index.ts", "qualifiedName": "buildIndex", "importance": "REQUIRED", "rationale": "The producer operating inside that boundary." }
      ],
      "goldRanges": [],
      "notes": "Natural-language concurrency case; REQUIRED scope is intentionally limited to the writer boundary and producer."
    },
    {
      "taskId": "self-stale-lexical-source",
      "repositoryId": "contextforge-phase5",
      "repositoryRevision": "77944250fe022794cb4b86b96415c8fac625f632",
      "taskText": "Search must not rank changed working-tree bytes as evidence from the active generation.",
      "taskCategory": "BUG_FIX",
      "languageTags": ["typescript"],
      "difficulty": "MEDIUM",
      "goldFiles": [
        { "path": "src/application/search-repository.ts", "importance": "REQUIRED", "rationale": "Verifies lexical bytes against the active generation and reports stale status." },
        { "path": "src/adapters/filesystem/repository-source-reader.ts", "importance": "REQUIRED", "rationale": "Performs the bounded read and produces the content hash used by Search." },
        { "path": "test/integration/search-repository.test.ts", "importance": "SUPPORTING", "rationale": "Exercises changed and added source without mutating the active index." }
      ],
      "goldSymbols": [
        { "path": "src/application/search-repository.ts", "qualifiedName": "searchRepository", "importance": "REQUIRED", "rationale": "Public application use case for generation-verified retrieval." },
        { "path": "src/adapters/filesystem/repository-source-reader.ts", "qualifiedName": "FileSystemRepositorySourceReader.readTextFile", "importance": "REQUIRED", "rationale": "Returns the hash of the exact bytes used as lexical evidence." }
      ],
      "goldRanges": [],
      "notes": "Does not name exact paths and requires understanding the Search/source-reader boundary."
    },
    {
      "taskId": "self-output-publish-race",
      "repositoryId": "contextforge-phase5",
      "repositoryRevision": "77944250fe022794cb4b86b96415c8fac625f632",
      "taskText": "Prevent a concurrent pack output writer from overwriting an artifact that appeared after the preflight check.",
      "taskCategory": "CROSS_FILE_BUG_FIX",
      "languageTags": ["typescript"],
      "difficulty": "MEDIUM",
      "goldFiles": [
        { "path": "src/adapters/filesystem/output-artifact-writer.ts", "importance": "REQUIRED", "rationale": "Implements exclusive temporary publication and maps EEXIST safely." },
        { "path": "src/application/output-artifact.ts", "importance": "SUPPORTING", "rationale": "Defines the application port kept independent of filesystem mechanics." },
        { "path": "test/integration/output-artifact.test.ts", "importance": "SUPPORTING", "rationale": "Covers overwrite and publication failure behavior." }
      ],
      "goldSymbols": [
        { "path": "src/adapters/filesystem/output-artifact-writer.ts", "qualifiedName": "FileSystemOutputArtifactWriter.writeExclusive", "importance": "REQUIRED", "rationale": "The TOCTOU-sensitive publication method." },
        { "path": "src/application/output-artifact.ts", "qualifiedName": "OutputArtifactWriter", "importance": "SUPPORTING", "rationale": "The architecture boundary implemented by the adapter." }
      ],
      "goldRanges": [],
      "notes": "Tests adapter behavior without treating unrelated pack ranking code as Gold."
    },
    {
      "taskId": "self-package-parser-assets",
      "repositoryId": "contextforge-phase5",
      "repositoryRevision": "77944250fe022794cb4b86b96415c8fac625f632",
      "taskText": "Repair the installed-package smoke check when parser WASM assets are omitted from the tarball.",
      "taskCategory": "CONFIGURATION",
      "languageTags": ["javascript", "typescript"],
      "difficulty": "MEDIUM",
      "goldFiles": [
        { "path": "scripts/package-smoke.mjs", "importance": "REQUIRED", "rationale": "Packs, installs, invokes, and verifies packaged parser assets." },
        { "path": "package.json", "importance": "REQUIRED", "rationale": "Defines package files, prepack build, bin, and package-smoke script." },
        { "path": "scripts/copy-parser-assets.mjs", "importance": "SUPPORTING", "rationale": "Copies parser assets into compiled output before packing." }
      ],
      "goldSymbols": [
        { "path": "scripts/package-smoke.mjs", "qualifiedName": "run", "importance": "REQUIRED", "rationale": "Executes each installed-package verification command." }
      ],
      "goldRanges": [],
      "notes": "Configuration/build case with one JavaScript helper symbol and two file-level contracts."
    },
    {
      "taskId": "self-pack-snapshot-architecture",
      "repositoryId": "contextforge-phase5",
      "repositoryRevision": "77944250fe022794cb4b86b96415c8fac625f632",
      "taskText": "Document why packing keeps one active generation and refuses to persist source content.",
      "taskCategory": "DOCUMENTATION_ARCHITECTURE",
      "languageTags": ["typescript"],
      "difficulty": "HARD",
      "goldFiles": [
        { "path": "docs/adr/ADR-006-hard-budget-context-packing.md", "importance": "REQUIRED", "rationale": "Records the accepted one-generation and source-privacy packing decision." },
        { "path": "src/application/build-context-pack.ts", "importance": "SUPPORTING", "rationale": "Implementation evidence for the documented boundary." },
        { "path": "docs/ARCHITECTURE.md", "importance": "SUPPORTING", "rationale": "Places the decision in the system-wide dependency and consistency model." }
      ],
      "goldSymbols": [],
      "goldRanges": [],
      "notes": "Architecture case intentionally has file-level Gold rather than brittle Markdown line numbers."
    },

    {
      "taskId": "ts-session-revoke-exact",
      "repositoryId": "curated-typescript-v1",
      "repositoryRevision": "sha256:4b2163c07e4a55d230f55a38c7da4e7f148046c8185a72c1b7718fcd6d6d14cc",
      "taskText": "Change SessionStore.revokeSession so repeated revocation stays idempotent.",
      "taskCategory": "EXACT_SYMBOL",
      "languageTags": ["typescript"],
      "difficulty": "EASY",
      "goldFiles": [
        { "path": "src/auth/session-store.ts", "importance": "REQUIRED", "rationale": "Owns the session record and revocation state transition." },
        { "path": "tests/auth-service.test.ts", "importance": "SUPPORTING", "rationale": "Existing revocation behavior check." }
      ],
      "goldSymbols": [